"MEDICAL_CODE_ID","DESCRIPTION","READ_CODE","SNOMED_CT_CODE","DATABASE"
"4697","Intrauterine growth retardation","Q10z.11","","CPRD_GOLD"
"9542","Maternal care for intrauterine growth retardation","L265311","","CPRD_GOLD"
"19575","Fetal growth retardation NOS","Q10z.00","","CPRD_GOLD"
"34777","Slow fetal growth and fetal malnutrition","Q10..00","","CPRD_GOLD"
"36640","Maternal care for poor fetal growth","L265300","","CPRD_GOLD"
"67883","Maternal care for poor fetal growth","L514.00","","CPRD_GOLD"
"68518","Disorders due to slow fetal growth, low and high birthweight","Q1...00","","CPRD_GOLD"
"70310","Disorders slow fetal growth, low and high birthweight NOS","Q1z..00","","CPRD_GOLD"
"94611","Disorders slow fetal growth, low and high birthweight OS","Q1y..00","","CPRD_GOLD"
