"MEDICAL_CODE_ID","DESCRIPTION","READ_CODE","SNOMED_CT_CODE","DATABASE"
"355642011","Placental insufficiency","L265.11","237292005","CPRD_AURUM"
"359997012","Fetus affected by placental insufficiency","Q022.11","240322003","CPRD_AURUM"
"893831000006116","Maternal placental insuffic.","Q022299","206079007","CPRD_AURUM"
"5146201000006119","Foetal effect of placental insufficiency","","240322003","CPRD_AURUM"
"4833691000006117","Fetal or neonatal effect of placental insufficiency","","206079007","CPRD_AURUM"
"5146181000006115","Fetal effect of placental insufficiency","","240322003","CPRD_AURUM"
"315945011","Fetus or neonate affected by placental insufficiency","Q022200","206079007","CPRD_AURUM"
"4833711000006119","Foetal or neonatal effect of placental insufficiency","","206079007","CPRD_AURUM"
