"MEDICAL_CODE_ID","DESCRIPTION","READ_CODE","SNOMED_CT_CODE","DATABASE"
"O60","Preterm labour and delivery","O60","","ICD10"
"O601","Preterm spontaneous labour with preterm delivery","O60.1","","ICD10"
"O602","Preterm spontaneous labour with term delivery","O60.2","","ICD10"
"O603","Preterm delivery without spontaneous labour","O60.3","","ICD10"
"P072","Extreme immaturity","P07.2","","ICD10"
"P073","Other preterm infants","P07.3","","ICD10"
"P590","Neonatal jaundice associated with preterm delivery","P59.0","","ICD10"
"P612","Anaemia of prematurity","P61.2","","ICD10"
