"MEDICAL_CODE_ID","DESCRIPTION","READ_CODE","SNOMED_CT_CODE","DATABASE"
"424","Premature rupture of membranes","L281.00","","CPRD_GOLD"
"53828","Premature rupture of membranes - delivered","L281100","","CPRD_GOLD"
"53829","Premature rupture of membranes NOS","L281z00","","CPRD_GOLD"
"62278","Premature rupture of membranes, labour delayed by therapy","L281400","","CPRD_GOLD"
"63022","Prem rupture of membranes onset of labour after 24 hours","L281500","","CPRD_GOLD"
"64548","Prem rupture of membranes onset of labour within 24 hours","L281300","","CPRD_GOLD"
"65716","Fetus/neonate affected maternal premature rupture membrane","Q011.00","","CPRD_GOLD"
"69713","Premature rupture of membranes unspecified","L281000","","CPRD_GOLD"
"97391","Premature rupture of membranes with antenatal problem","L281200","","CPRD_GOLD"
